{
  "id": "projection:example-company:003:public",
  "company_id": "company:example-company",
  "snapshot_id": "snapshot:example-company:003",
  "audience": "public",
  "purpose": "research",
  "claim_ids": [
    "claim:company-category-v2",
    "claim:example-product-positioning-v1"
  ],
  "history_claim_ids": [
    "claim:company-category-v1"
  ],
  "conflict_claim_ids": [
    "claim:example-product-positioning-v1"
  ],
  "retraction_claim_ids": [],
  "redacted_conflict_count": 1,
  "evidence_ids": [
    "evidence:public-category",
    "evidence:public-category-v2",
    "evidence:public-product"
  ],
  "record_ids": [
    "record:public-profile-v1",
    "record:public-profile-v2"
  ],
  "event_ids": [
    "event:public-profile-observed"
  ],
  "run_ids": [
    "run:example-company:001",
    "run:example-company:002"
  ],
  "relation_ids": [
    "relation:example-company-offers-example-product"
  ],
  "created_at": "2026-07-01T01:00:00+00:00",
  "content_hash": "sha256:763389a233781d591d0b9e1595762963e99d55739a63698e4f6d6f8b22b26b84"
}
