{
  "id": "projection:example-company:003:sales",
  "company_id": "company:example-company",
  "snapshot_id": "snapshot:example-company:003",
  "audience": "sales",
  "purpose": "account-planning",
  "claim_ids": [
    "claim:company-category-v2",
    "claim:example-product-positioning-v1",
    "claim:opportunity-stage-validation"
  ],
  "history_claim_ids": [
    "claim:company-category-v1",
    "claim:opportunity-stage-discovery",
    "claim:procurement-centralized",
    "claim:procurement-statement-retracted"
  ],
  "conflict_claim_ids": [
    "claim:example-product-positioning-v1"
  ],
  "retraction_claim_ids": [
    "claim:procurement-statement-retracted"
  ],
  "redacted_conflict_count": 1,
  "evidence_ids": [
    "evidence:crm-opportunity",
    "evidence:crm-validation",
    "evidence:interview-correction",
    "evidence:interview-procurement",
    "evidence:public-category",
    "evidence:public-category-v2",
    "evidence:public-product"
  ],
  "record_ids": [
    "record:crm-opportunity-001",
    "record:crm-opportunity-002",
    "record:interview-correction",
    "record:interview-segment-001",
    "record:public-profile-v1",
    "record:public-profile-v2"
  ],
  "event_ids": [
    "event:interview-001",
    "event:opportunity-discovery",
    "event:opportunity-validation",
    "event:public-profile-observed"
  ],
  "run_ids": [
    "run:example-company:001",
    "run:example-company:002",
    "run:example-company:003"
  ],
  "relation_ids": [
    "relation:account-has-opportunity",
    "relation:example-company-offers-example-product"
  ],
  "created_at": "2026-07-01T01:00:00+00:00",
  "content_hash": "sha256:5294ccb5ac0fba90b31725e0598cc683223e337f44bc0877f00a43f915244aa1"
}
