{
  "id": "projection:northstar-industries:003:customer-success",
  "company_id": "company:northstar-industries",
  "snapshot_id": "snapshot:northstar:003",
  "audience": "customer-success",
  "purpose": "customer-success",
  "claim_ids": [
    "claim:company-category-v2",
    "claim:orbit-positioning-v1",
    "claim:sev1-observed",
    "claim:usage-active-sites"
  ],
  "history_claim_ids": [
    "claim:company-category-v1"
  ],
  "conflict_claim_ids": [
    "claim:orbit-positioning-v1",
    "claim:sev1-observed"
  ],
  "retraction_claim_ids": [],
  "redacted_conflict_count": 0,
  "evidence_ids": [
    "evidence:public-category",
    "evidence:public-category-v2",
    "evidence:public-product",
    "evidence:ticket-sev1",
    "evidence:usage-active-sites"
  ],
  "record_ids": [
    "record:public-profile-v1",
    "record:public-profile-v2",
    "record:support-ticket-042",
    "record:usage-june"
  ],
  "event_ids": [
    "event:public-profile-observed",
    "event:ticket-resolved-042",
    "event:usage-june"
  ],
  "run_ids": [
    "run:northstar:001",
    "run:northstar:002",
    "run:northstar:003"
  ],
  "relation_ids": [
    "relation:northstar-offers-orbit",
    "relation:subscription-uses-orbit"
  ],
  "created_at": "2026-07-01T01:00:00+00:00",
  "content_hash": "sha256:10b69c631ed9a65eabeb0c5d1b866358d91c4b8f11c94fa9cbb5e192ccb0e83f"
}
