{
  "id": "projection:byd:002:public",
  "company_id": "company:byd",
  "snapshot_id": "snapshot:byd:002",
  "audience": "public",
  "purpose": "research",
  "claim_ids": [
    "claim:byd-auto-segment-revenue-fy2025",
    "claim:byd-bev-sales-ytd-july-2026",
    "claim:byd-blade-battery-offering-2026",
    "claim:byd-handset-segment-revenue-fy2025",
    "claim:byd-legal-identity-2025",
    "claim:byd-listings-2025",
    "claim:byd-nev-exports-july-2026",
    "claim:byd-nev-sales-july-2026",
    "claim:byd-nev-sales-yoy-ytd-july-2026",
    "claim:byd-nev-sales-ytd-july-2026",
    "claim:byd-overseas-revenue-fy2025",
    "claim:byd-phev-sales-ytd-july-2026",
    "claim:byd-prc-revenue-fy2025",
    "claim:byd-principal-activities-2025",
    "claim:byd-profit-attributable-fy2025",
    "claim:byd-rd-expense-fy2025",
    "claim:byd-revenue-fy2025",
    "claim:byd-total-assets-2025"
  ],
  "history_claim_ids": [],
  "conflict_claim_ids": [],
  "retraction_claim_ids": [],
  "redacted_conflict_count": 0,
  "evidence_ids": [
    "evidence:byd-2025-ar-financials-p5",
    "evidence:byd-2025-ar-geography-p349",
    "evidence:byd-2025-ar-profile-p2",
    "evidence:byd-2025-ar-rd-p368",
    "evidence:byd-2025-ar-segments-p347",
    "evidence:byd-2026-07-export-note-p2",
    "evidence:byd-2026-07-powertrain-table-p1",
    "evidence:byd-2026-07-sales-table-p1",
    "evidence:byd-web-about-listing",
    "evidence:byd-web-blade-battery"
  ],
  "record_ids": [
    "record:byd-2025-company-profile",
    "record:byd-2025-financial-highlights",
    "record:byd-2025-geographic-revenue",
    "record:byd-2025-segment-revenue",
    "record:byd-2026-07-production-sales",
    "record:byd-web-technology-profile"
  ],
  "event_ids": [
    "event:byd-2025-annual-report-published",
    "event:byd-2026-07-sales-update"
  ],
  "run_ids": [
    "run:byd:001",
    "run:byd:002"
  ],
  "relation_ids": [
    "relation:byd-auto-offers-blade",
    "relation:byd-contains-auto-battery",
    "relation:byd-contains-handset",
    "relation:byd-contains-legal",
    "relation:byd-contains-rail",
    "relation:byd-targets-global-nev"
  ],
  "created_at": "2026-08-16T09:15:00+08:00",
  "content_hash": "sha256:0fca65b4151ed7abeb17ccf30bcbbb706a23fca48027191acd49043afc04c013"
}
